{
  "$schema": "https://json-schema.org/draft/2020-12/schema",
  "$id": "https://makerspace.network/schema/space/0.1.0",
  "title": "Makerspace Network \u2014 Space record",
  "description": "A makerspace, hackerspace, fab lab, or comparable shared workshop. A profile of Open Know-Where's ManufacturingFacility, extended with the operational fields a directory user actually filters on and with the provenance OKW requires. Crosswalks to OKW, SpaceAPI, fablabs.io and the Entrepreneurship Nexus compact are recorded in docs/INTEROP.md; enum values live in enums.json.",
  "type": "object",
  "required": [
    "id",
    "name",
    "kind",
    "status",
    "sources",
    "verification"
  ],
  "additionalProperties": false,
  "properties": {
    "id": {
      "type": "string",
      "pattern": "^[a-z0-9]+(-[a-z0-9]+)*$",
      "description": "Stable slug. Never reused, never renamed once published."
    },
    "name": {
      "type": "string",
      "description": "Common name, as the space writes it."
    },
    "legal_name": {
      "type": "string",
      "description": "Legal entity name, if different."
    },
    "kind": {
      "type": "string",
      "$comment": "enum: SpaceKind"
    },
    "status": {
      "type": "string",
      "$comment": "enum: OperatingStatus"
    },
    "summary": {
      "type": "string",
      "maxLength": 400,
      "description": "One or two sentences, for directory cards."
    },
    "description": {
      "type": "string",
      "description": "Longer prose, Markdown permitted."
    },
    "year_founded": {
      "type": "integer",
      "minimum": 1900
    },
    "region_ids": {
      "type": "array",
      "items": {
        "type": "string"
      },
      "description": "Regions this space belongs to, e.g. ['us-ct']. The multi-state tenancy key \u2014 the analogue of ecosystem_ids in the Nexus compact. Optional since 0.3.0: a space belongs to the network first and to a region once one exists for its state (docs/GOVERNANCE.md). Its state is address.region."
    },
    "size_tier": {
      "type": "string",
      "$comment": "enum: SizeTier",
      "description": "How the network convenes by size. Thresholds are a network decision recorded on the region, not here."
    },
    "address": {
      "type": "object",
      "additionalProperties": false,
      "description": "OKW Address.",
      "properties": {
        "street": {
          "type": "string"
        },
        "street_2": {
          "type": "string"
        },
        "locality": {
          "type": "string",
          "description": "City or town. OKW: locality."
        },
        "county": {
          "type": "string",
          "description": "County, for regional grouping."
        },
        "region": {
          "type": "string",
          "description": "State or province code, e.g. 'CT'."
        },
        "postal_code": {
          "type": "string"
        },
        "country": {
          "type": "string",
          "description": "ISO 3166-1 alpha-2."
        },
        "latitude": {
          "type": "number",
          "minimum": -90,
          "maximum": 90
        },
        "longitude": {
          "type": "number",
          "minimum": -180,
          "maximum": 180
        },
        "notes": {
          "type": "string",
          "description": "How to actually find the door."
        }
      }
    },
    "contact": {
      "type": "object",
      "additionalProperties": false,
      "description": "OKW Contact.",
      "properties": {
        "website": {
          "type": "string",
          "format": "uri"
        },
        "email": {
          "type": "string",
          "format": "email"
        },
        "phone": {
          "type": "string"
        },
        "social": {
          "type": "object",
          "additionalProperties": {
            "type": "string",
            "format": "uri"
          }
        }
      }
    },
    "logo_url": {
      "type": "string",
      "format": "uri"
    },
    "photo_url": {
      "type": "string",
      "format": "uri"
    },
    "operations": {
      "type": "object",
      "additionalProperties": false,
      "description": "The fields a person choosing a space actually filters on, and which the superseded Google Site did not carry.",
      "properties": {
        "access_model": {
          "type": "string",
          "$comment": "enum: AccessModel"
        },
        "public_access": {
          "type": "boolean",
          "description": "Can a non-member use the space at all, by any route?"
        },
        "tax_status": {
          "type": "string",
          "$comment": "enum: TaxStatus"
        },
        "membership_models": {
          "type": "array",
          "items": {
            "type": "string"
          },
          "$comment": "enum: MembershipModel"
        },
        "monthly_cost_usd": {
          "type": "object",
          "additionalProperties": false,
          "properties": {
            "min": {
              "type": "number"
            },
            "max": {
              "type": "number"
            },
            "as_of": {
              "type": "string",
              "format": "date"
            }
          },
          "description": "Range across tiers. Always dated \u2014 prices rot faster than anything else in this record."
        },
        "day_pass_usd": {
          "type": "number"
        },
        "minor_policy": {
          "type": "string",
          "$comment": "enum: MinorPolicy"
        },
        "tool_lending": {
          "type": "boolean"
        },
        "square_feet": {
          "type": "integer"
        },
        "staff_fte": {
          "type": "number",
          "description": "Paid full-time equivalents. 0 means volunteer-run."
        },
        "hours_note": {
          "type": "string"
        }
      }
    },
    "capabilities": {
      "type": "array",
      "items": {
        "type": "string"
      },
      "uniqueItems": true,
      "$comment": "enum: Capability",
      "description": "What can be made here. Granular by design \u2014 fablabs.io's six values do not discriminate between spaces."
    },
    "equipment": {
      "type": "array",
      "description": "OKW ManufacturingEquipment. Optional and usually incomplete; capabilities[] is the field the directory filters on.",
      "items": {
        "type": "object",
        "required": [
          "capability"
        ],
        "additionalProperties": false,
        "properties": {
          "capability": {
            "type": "string",
            "$comment": "enum: Capability"
          },
          "brand": {
            "type": "string"
          },
          "model": {
            "type": "string"
          },
          "count": {
            "type": "integer",
            "minimum": 1
          },
          "notes": {
            "type": "string"
          }
        }
      }
    },
    "endpoints": {
      "type": "object",
      "additionalProperties": false,
      "description": "URLs the space itself publishes. Where one exists it outranks anything stored here \u2014 see the self_managed verification status.",
      "properties": {
        "spaceapi": {
          "type": "string",
          "format": "uri",
          "description": "SpaceAPI v14/v15 endpoint. Source of live open/closed state."
        },
        "ical": {
          "type": "string",
          "format": "uri",
          "description": "Public event calendar."
        },
        "rss": {
          "type": "string",
          "format": "uri"
        }
      }
    },
    "external_refs": {
      "type": "array",
      "description": "This space's identity in other systems. The same reconciliation primitive as external_ref in the Nexus partner API: everyone keeps their own IDs.",
      "items": {
        "type": "object",
        "required": [
          "system",
          "id"
        ],
        "additionalProperties": false,
        "properties": {
          "system": {
            "type": "string",
            "$comment": "enum: SourceSystem"
          },
          "id": {
            "type": "string"
          },
          "url": {
            "type": "string",
            "format": "uri"
          }
        }
      }
    },
    "standards": {
      "type": "object",
      "additionalProperties": false,
      "description": "Participation in the Standards of Excellence framework (tools/standards). Only ever the summary a space chose to share \u2014 per-standard scores and evidence never leave the space. See tools/standards/README.md on why. Standards level is also what makes a space a recognised issuer for reciprocity \u2014 see docs/RECIPROCITY.md \u00a75.",
      "properties": {
        "participating": {
          "type": "boolean"
        },
        "level": {
          "type": "string",
          "enum": [
            "foundational",
            "operational",
            "exemplary"
          ]
        },
        "assessed_on": {
          "type": "string",
          "format": "date"
        },
        "shared_publicly": {
          "type": "boolean",
          "description": "False by default. A level is published only with the space's explicit consent."
        }
      }
    },
    "reciprocity": {
      "type": "object",
      "additionalProperties": false,
      "description": "Phase 3. Whether this space issues and accepts Open Badges 3.0 credentials for cross-space recognition. See docs/RECIPROCITY.md \u2014 the member carries the credential, so neither space needs to integrate with the other.",
      "properties": {
        "issues": {
          "type": "boolean",
          "description": "This space signs AchievementCredentials for its own members."
        },
        "accepts": {
          "type": "boolean",
          "description": "This space will honour credentials issued by recognised issuers in the network."
        },
        "issuer_id": {
          "type": "string",
          "description": "The issuer's identifier in issued credentials \u2014 a did:web or an HTTPS profile URL."
        },
        "public_keys_url": {
          "type": "string",
          "format": "uri",
          "description": "Hosted JWKS or DID document. Verifiers fetch this once and cache it; they never contact the issuer per verification."
        },
        "status_list_url": {
          "type": "string",
          "format": "uri",
          "description": "credentialStatus StatusList2021 endpoint for revocation."
        },
        "achievements_aligned": {
          "type": "array",
          "items": {
            "type": "string"
          },
          "uniqueItems": true,
          "description": "Network achievement definition IDs this space issues against, e.g. 'laser-co2-operator/v1'. The space keeps its own local badge names; this records the mapping."
        },
        "recognised_issuer": {
          "type": "boolean",
          "description": "Derived, not asserted. True when the space's Standards assessment reaches Operational on tool authorisation and hazard assessment. Do not set this by hand \u2014 see docs/RECIPROCITY.md \u00a75."
        },
        "terms": {
          "type": "string",
          "description": "Any conditions attached, e.g. 'day access only, no independent after-hours use'."
        }
      }
    },
    "sources": {
      "type": "array",
      "minItems": 1,
      "description": "OKW DatabaseSourceMetadata, per record. Where every claim in this file came from.",
      "items": {
        "type": "object",
        "required": [
          "system",
          "retrieved"
        ],
        "additionalProperties": false,
        "properties": {
          "system": {
            "type": "string",
            "$comment": "enum: SourceSystem"
          },
          "url": {
            "type": "string",
            "format": "uri"
          },
          "retrieved": {
            "type": "string",
            "format": "date"
          },
          "note": {
            "type": "string"
          }
        }
      }
    },
    "verification": {
      "type": "object",
      "required": [
        "status"
      ],
      "additionalProperties": false,
      "description": "OKW DataVerificator. A directory is only as trustworthy as this field, and stale records are the failure mode that killed every crowdsourced maker map surveyed in docs/INTEROP.md.",
      "properties": {
        "status": {
          "type": "string",
          "$comment": "enum: VerificationStatus"
        },
        "verified_by": {
          "type": "string",
          "description": "The regional steward or space contact who checked it."
        },
        "verified_on": {
          "type": "string",
          "format": "date"
        },
        "gaps": {
          "type": "array",
          "items": {
            "type": "string"
          },
          "description": "Fields known to be missing or unconfirmed. Being explicit here is why an incomplete record is still publishable."
        }
      }
    }
  }
}
