{
  "id": "makerspace-ct",
  "name": "MakerspaceCT",
  "kind": "community_makerspace",
  "status": "active",
  "summary": "A large, professionally equipped makerspace in Hartford with extensive metal and machine shops, woodworking, digital fabrication and textiles.",
  "region_ids": [
    "us-ct"
  ],
  "address": {
    "street": "36 Talcott Street",
    "locality": "Hartford",
    "county": "Hartford",
    "region": "CT",
    "postal_code": "06103",
    "country": "US",
    "latitude": 41.7683982,
    "longitude": -72.6724243
  },
  "contact": {
    "website": "https://makerspacect.com",
    "phone": "+1-860-619-6254",
    "email": "info@makerspacect.com"
  },
  "logo_url": "/logos/makerspace-ct.png",
  "operations": {
    "tax_status": "nonprofit_501c3",
    "square_feet": 28000,
    "hours_note": "Tue 5pm–9pm; Thu, Fri and Sat 10am–9pm; Sun 10am–6pm.",
    "access_model": "staffed_hours_only",
    "public_access": true,
    "membership_models": [
      "monthly_membership",
      "annual_membership"
    ],
    "minor_policy": "minors_in_programs"
  },
  "capabilities": [
    "metalworking_machine",
    "cnc_mill",
    "cnc_lathe",
    "welding_mig_tig",
    "sheet_metal",
    "woodworking_machine",
    "wood_turning",
    "three_d_printing_fdm",
    "laser_cutting",
    "cnc_router",
    "textiles_sewing",
    "computer_workstations",
    "jewelry"
  ],
  "sources": [
    {
      "system": "ct_google_site",
      "url": "https://sites.google.com/makerspace.network/connecticut",
      "retrieved": "2026-08-28",
      "note": "Superseded Google Site, recovered 2026-08-28 from its still-live sites.google.com address. Street address, website and descriptive text are transcribed from it verbatim. The logo is the space's own mark, recovered from the same page."
    },
    {
      "system": "ct_google_site",
      "url": "https://www.google.com/maps/d/viewer?mid=1SSnuE9p2Uh0al972HHFjKRJxSZZ1GHc",
      "retrieved": "2026-08-28",
      "note": "'CT Makerspaces Map' My Map attached to the superseded site. Coordinates are the 'MakerspaceCT' pin, transcribed from its KML, not geocoded."
    },
    {
      "system": "space_website",
      "url": "https://makerspacect.com/join-the-movement/",
      "retrieved": "2026-08-29",
      "note": "Own site: 28,000 sq ft in the G. Fox Building; operating hours Fri 10am–9pm, Sat 10am–6pm, closed Sun–Thu."
    },
    {
      "system": "direct_contact",
      "url": "https://makerspace.network/?page=space-data&space=makerspace-ct",
      "retrieved": "2026-10-07",
      "note": "Listing confirmed by the space's own staff on makerspace.network: summary, capabilities (adding jewelry), access during staffed hours, open to non-members, monthly and annual membership, minors in supervised programs, current hours, phone and email. Cost left blank."
    }
  ],
  "verification": {
    "status": "space_confirmed",
    "verified_by": "the space's staff, via makerspace.network",
    "verified_on": "2026-10-07",
    "gaps": [
      "address and coordinates come from the superseded Google Site and its map; the space has not been asked to confirm them",
      "monthly_cost_usd — membership prices are behind app.makerspacect.com and the space left cost blank",
      "reported as both 28,000 sq ft (own site) and 20,000 sq ft (Hartford Business Journal); the space's own figure is used"
    ]
  }
}
