{
  "id": "nchic",
  "name": "NCHIC",
  "kind": "community_makerspace",
  "status": "active",
  "region_ids": [
    "us-ct"
  ],
  "summary": "A Health Foundation project in development supporting veterans, with 3D printing and scanning.",
  "address": {
    "county": "Litchfield",
    "region": "CT",
    "country": "US"
  },
  "operations": {
    "tax_status": "nonprofit_other"
  },
  "capabilities": [
    "three_d_printing_fdm",
    "three_d_scanning"
  ],
  "sources": [
    {
      "system": "ct_google_site",
      "url": "https://sites.google.com/makerspace.network/connecticut",
      "retrieved": "2026-08-28",
      "note": "Superseded Google Site, recovered 2026-08-28 from its still-live sites.google.com address. Street address, website and descriptive text are transcribed from it verbatim."
    }
  ],
  "verification": {
    "status": "imported",
    "verified_on": "2026-08-28",
    "gaps": [
      "the superseded Google Site listed SPARK Makerspace's New London address under this Litchfield County entry — a copy-paste error there, so no address is recorded here",
      "street address",
      "coordinates",
      "email",
      "phone",
      "access_model",
      "membership_models",
      "monthly_cost_usd",
      "minor_policy",
      "capabilities are inferred from prose on the superseded Google Site and are not confirmed",
      "listed as in development — confirm whether status should be 'forming' rather than 'active'"
    ]
  },
  "contact": {
    "website": "https://www.nchic.org/projectoverview"
  }
}
