{
  "id": "wilton-library",
  "name": "Wilton Library",
  "kind": "library_makerspace",
  "status": "active",
  "region_ids": [
    "us-ct"
  ],
  "address": {
    "county": "Fairfield",
    "region": "CT",
    "country": "US",
    "latitude": 41.192668,
    "longitude": -73.431569
  },
  "sources": [
    {
      "system": "ct_google_site",
      "url": "https://www.google.com/maps/d/viewer?mid=1SSnuE9p2Uh0al972HHFjKRJxSZZ1GHc",
      "retrieved": "2026-08-28",
      "note": "'CT Makerspaces Map' attached to the superseded Google Site. This record is the 'Wilton Library' pin and nothing else — the pin carried a name and a location, no other detail."
    }
  ],
  "verification": {
    "status": "imported",
    "verified_on": "2026-08-28",
    "gaps": [
      "this record is a map pin recovered from the superseded Google Site — the name and approximate location are all that is sourced",
      "the space kind is inferred from the pin's name and is not confirmed",
      "confirm the space still operates, and under this name",
      "street address",
      "website",
      "email",
      "phone",
      "access_model",
      "membership_models",
      "monthly_cost_usd",
      "minor_policy",
      "capabilities"
    ]
  }
}
